{
  "schema_version": 1,
  "title": "7 клас · Traditions... Traditions...: Лексика Свята і традиції · Лексика",
  "grade": 7,
  "purpose": "homework_check",
  "source_lesson": "7/sb-u4-vocabulary/index.html",
  "source_title": "Traditions... Traditions...: Лексика Свята і традиції · Лексика",
  "assessment_lesson": "7/sb-u4-reading/index.html",
  "placement": {
    "rule": "next_lesson",
    "note": "Перевірка домашнього завдання за попередньою темою на наступному уроці."
  },
  "total_points": 10,
  "questions": [
    {
      "type": "choice",
      "prompt": "Обери значення слова custom.",
      "points": 1,
      "options": [
        "переддень",
        "північ",
        "звичай",
        "Жоден із наведених варіантів"
      ],
      "key": 2
    },
    {
      "type": "choice",
      "prompt": "Обери значення слова celebrate.",
      "points": 1,
      "options": [
        "святкувати",
        "північ",
        "свічка",
        "Жоден із наведених варіантів"
      ],
      "key": 0
    },
    {
      "type": "choice",
      "prompt": "Обери значення слова Eve.",
      "points": 1,
      "options": [
        "отримувати",
        "переддень",
        "свічка",
        "Жоден із наведених варіантів"
      ],
      "key": 1
    },
    {
      "type": "choice",
      "prompt": "Cards ___ sent to grandparents.",
      "points": 1,
      "options": [
        "is",
        "be",
        "are",
        "Жоден із наведених варіантів"
      ],
      "key": 2
    },
    {
      "type": "choice",
      "prompt": "The holiday ___ celebrated in winter.",
      "points": 1,
      "options": [
        "is",
        "are",
        "do",
        "Жоден із наведених варіантів"
      ],
      "key": 0
    },
    {
      "type": "choice",
      "prompt": "Special food is ___ at home.",
      "points": 1,
      "options": [
        "preparing",
        "prepared",
        "prepare",
        "Жоден із наведених варіантів"
      ],
      "key": 1
    },
    {
      "type": "choice",
      "prompt": "Прочитай текст і визнач правильну відповідь.\n\nOur class is comparing family celebrations. In one family, special food is prepared on New Year’s Eve. In another, cards are sent to grandparents. The pupils explain when each tradition is followed and why it matters. They notice that customs differ, but many celebrations bring people together.\n\nWhat is the class comparing?",
      "points": 2,
      "options": [
        "sports scores",
        "film tickets",
        "family celebrations",
        "Жоден із наведених варіантів"
      ],
      "key": 2
    },
    {
      "type": "choice",
      "prompt": "Прочитай текст і визнач правильну відповідь.\n\nOur class is comparing family celebrations. In one family, special food is prepared on New Year’s Eve. In another, cards are sent to grandparents. The pupils explain when each tradition is followed and why it matters. They notice that customs differ, but many celebrations bring people together.\n\nWho receives cards in one family?",
      "points": 2,
      "options": [
        "grandparents",
        "a referee",
        "a tour guide",
        "Жоден із наведених варіантів"
      ],
      "key": 0
    }
  ],
  "id": "7-sb-u4-vocabulary-homework-01",
  "platforms": {
    "naurok": {
      "test_id": "3887084",
      "test_url": "https://naurok.com.ua/test-beta/test/3887084",
      "status": "published_pending_homework_daily_limit",
      "verified": true,
      "deadline": "2027-01-03T23:00",
      "semester": 1,
      "points": 10,
      "question_points": [
        1,
        1,
        1,
        1,
        1,
        1,
        2,
        2
      ]
    },
    "kahoot": {
      "id": "20756b11-7967-4958-86e3-8f4bf07e0794",
      "editor_url": "https://create.kahoot.it/creator/20756b11-7967-4958-86e3-8f4bf07e0794",
      "test_url": "https://create.kahoot.it/details/7-049-traditions-grammar/20756b11-7967-4958-86e3-8f4bf07e0794",
      "title": "7 клас · 049 · Traditions: Grammar",
      "status": "homework_created",
      "verified": true,
      "visibility": "public",
      "question_count": 8,
      "content_slide_count": 2,
      "kahoot_question_weights": [
        1,
        1,
        1,
        1,
        1,
        1,
        2,
        2
      ],
      "normalization_max": 10,
      "normalization_formula": "earned_points / maximum_possible_kahoot_score * 10",
      "scoring_ui_verified": true,
      "assignment_verified": true,
      "assignment_id": "5eb188e1-2b40-42d5-9807-31fd8b8f1fa5",
      "teacher_assignment_url": "https://create.kahoot.it/reports/new-challenge/5eb188e1-2b40-42d5-9807-31fd8b8f1fa5/7232023c-aa35-4b97-9ba5-76aaead1c7a9/1793252446941/summary",
      "code": "0038058023",
      "student_url": "https://kahoot.it/challenge/0038058023",
      "deadline": null,
      "no_deadline": true,
      "question_timer": false,
      "student_entry_verified": true,
      "content_verified_after_reopen": true,
      "course_id": "9d134573-e692-403a-ae7d-3267fa4fb7f3",
      "course_title": "7 клас",
      "course_module": 4,
      "course_module_number": 4,
      "course_membership_verified": true,
      "course_status": "draft_due_empty_module_7",
      "assessment_lesson_path": "7/sb-u4-reading/index.html",
      "created_at": "2026-10-29T07:40:46+02:00",
      "verification_evidence": "Editor confirms public visibility and 10 total steps (8 scored questions plus 2 reading slides). Questions 1–6 standard points; questions 7–8 double points. Assignment report confirms no deadline, code 0038058023, 0 participants; course editor confirms module 4. Course remains a draft because module 7 is empty.",
      "reused_existing_kahoot": true,
      "near_duplicate_of": "7-sb-u4-grammar-homework-01",
      "unique_difference": "None; all 8 prompts, correct answers, option sets and weights match within grade 7."
    }
  },
  "assessment": {
    "deadline": "2027-01-03T23:00",
    "semester": 1,
    "timezone": "Europe/Kyiv"
  }
}
