{
  "schema_version": 1,
  "title": "7 клас · Are you ready to cook?: Починаємо юніт Приготування їжі · Починаємо юніт",
  "grade": 7,
  "purpose": "homework_check",
  "source_lesson": "7/sb-u3-lead-in/index.html",
  "source_title": "Are you ready to cook?: Починаємо юніт Приготування їжі · Починаємо юніт",
  "assessment_lesson": "7/sb-u3-blog/index.html",
  "placement": {
    "rule": "next_lesson",
    "note": "Перевірка домашнього завдання за попередньою темою на наступному уроці."
  },
  "total_points": 10,
  "questions": [
    {
      "type": "choice",
      "prompt": "Обери значення слова chopping board.",
      "points": 1,
      "options": [
        "ополоник",
        "сковорода",
        "обробна дошка",
        "Жоден із наведених варіантів"
      ],
      "key": 2
    },
    {
      "type": "choice",
      "prompt": "Обери значення слова grater.",
      "points": 1,
      "options": [
        "тертка",
        "сковорода",
        "помішувати",
        "Жоден із наведених варіантів"
      ],
      "key": 0
    },
    {
      "type": "choice",
      "prompt": "Обери значення слова ladle.",
      "points": 1,
      "options": [
        "варити; кип’ятити",
        "ополоник",
        "помішувати",
        "Жоден із наведених варіантів"
      ],
      "key": 1
    },
    {
      "type": "choice",
      "prompt": "Eva ___ washed the tomatoes.",
      "points": 1,
      "options": [
        "have",
        "is",
        "has",
        "Жоден із наведених варіантів"
      ],
      "key": 2
    },
    {
      "type": "choice",
      "prompt": "Have you ___ the vegetables?",
      "points": 1,
      "options": [
        "chopped",
        "chop",
        "chopping",
        "Жоден із наведених варіантів"
      ],
      "key": 0
    },
    {
      "type": "choice",
      "prompt": "What ___ you prepared?",
      "points": 1,
      "options": [
        "has",
        "have",
        "did have",
        "Жоден із наведених варіантів"
      ],
      "key": 1
    },
    {
      "type": "choice",
      "prompt": "Прочитай текст і визнач правильну відповідь.\n\nThis unit is about cooking, recipes and experience. Before starting, I write down what I already know. I choose two useful words and one question I want to answer. At the end of the unit, I return to my question and check what I have learned.\n\nЩо я записую перед початком?",
      "points": 2,
      "options": [
        "only my final score",
        "a shopping receipt",
        "what I already know",
        "Жоден із наведених варіантів"
      ],
      "key": 2
    },
    {
      "type": "choice",
      "prompt": "Прочитай текст і визнач правильну відповідь.\n\nThis unit is about cooking, recipes and experience. Before starting, I write down what I already know. I choose two useful words and one question I want to answer. At the end of the unit, I return to my question and check what I have learned.\n\nКоли я повертаюся до свого запитання?",
      "points": 2,
      "options": [
        "at the end of the unit",
        "never",
        "only before starting",
        "Жоден із наведених варіантів"
      ],
      "key": 0
    }
  ],
  "id": "7-sb-u3-lead-in-homework-01",
  "platforms": {
    "naurok": {
      "test_id": "3886983",
      "test_url": "https://naurok.com.ua/test-beta/test/3886983",
      "status": "homework_created",
      "verified": true,
      "homework_id": "86401061",
      "teacher_homework_url": "https://naurok.com.ua/test-beta/homework/86401061",
      "student_url": "https://naurok.ua/test/join?gamecode=7149995",
      "code": "7149995",
      "deadline": "2027-01-03T23:00",
      "semester": 1,
      "points": 10,
      "question_points": [
        1,
        1,
        1,
        1,
        1,
        1,
        2,
        2
      ]
    },
    "kahoot": {
      "status": "homework_created",
      "verified": true,
      "visibility": "public",
      "kahoot_id": "e6221274-a676-4a84-a05e-bae19d12fb59",
      "title": "7 клас · 033a · Are you ready to cook?",
      "editor_url": "https://create.kahoot.it/creator/e6221274-a676-4a84-a05e-bae19d12fb59",
      "test_url": "https://create.kahoot.it/details/7-033a-are-you-ready-to-cook/e6221274-a676-4a84-a05e-bae19d12fb59",
      "assignment_id": "b1a6a67c-22aa-4b8d-bac4-2cbabcb7fc55",
      "teacher_assignment_url": "https://create.kahoot.it/reports/new-challenge/b1a6a67c-22aa-4b8d-bac4-2cbabcb7fc55/7232023c-aa35-4b97-9ba5-76aaead1c7a9/1793075452083/summary",
      "code": "009294852",
      "student_url": "https://kahoot.it/challenge/009294852",
      "no_deadline": true,
      "deadline": null,
      "question_count": 8,
      "content_slide_count": 1,
      "kahoot_question_weights": [
        1,
        1,
        1,
        1,
        1,
        1,
        2,
        2
      ],
      "normalization_max": 10,
      "normalization_formula": "earned_points / maximum_possible_kahoot_score * 10",
      "publication_status": "publication_verified",
      "assessment_lesson_path": "7/sb-u3-blog/",
      "commit_sha": "43df75c953b52b0faf684c4e7e745b67b7bf162e",
      "pages_run_id": "40451025537",
      "pages_run_url": "https://github.com/vovche/esl-lessons/actions/runs/40451025537",
      "pages_conclusion": "success",
      "live_page_url": "https://vovche.github.io/esl-lessons/7/sb-u3-blog/",
      "live_http_status": 200,
      "live_student_href_count": 1,
      "last_live_exact_href": "https://kahoot.it/challenge/009294852",
      "live_verified_at": "2026-10-27T07:42:00+03:00",
      "directions_uk_verified": true,
      "directions_verified_at": "2026-10-27T15:25:00Z",
      "course_id": "9d134573-e692-403a-ae7d-3267fa4fb7f3",
      "course_title": "7 клас",
      "course_module_number": 3,
      "course_membership_verified": true,
      "quiz_question_count": 8,
      "verification_evidence": "Existing Kahoot and assignment were found in the Kahoot library and reports before any create action. The 8 quiz items matched the Unit 3 lead-in source; English task prompts were translated to Ukrainian in the Kahoot editor and verified after saving. The report shows no deadline and 0 participants. The Kahoot is public and appears in course 7 клас, module 3."
    }
  },
  "assessment": {
    "deadline": "2027-01-03T23:00",
    "semester": 1,
    "timezone": "Europe/Kyiv"
  }
}
