{
  "schema_version": 1,
  "title": "7 клас · What is there to see and to do?: Повторення Подорожі й визначні місця · Повторення",
  "grade": 7,
  "purpose": "homework_check",
  "source_lesson": "7/sb-u8-look-back/index.html",
  "source_title": "What is there to see and to do?: Повторення Подорожі й визначні місця · Повторення",
  "assessment_lesson": "7/sb-u8-self-check/index.html",
  "placement": {
    "rule": "next_lesson",
    "note": "Перевірка домашнього завдання за попередньою темою на наступному уроці."
  },
  "total_points": 10,
  "questions": [
    {
      "type": "choice",
      "prompt": "Обери значення слова landmark.",
      "points": 1,
      "options": [
        "собор",
        "замок",
        "визначне місце",
        "Жоден із наведених варіантів"
      ],
      "key": 2
    },
    {
      "type": "choice",
      "prompt": "Обери значення слова capital.",
      "points": 1,
      "options": [
        "столиця",
        "замок",
        "екскурсовод",
        "Жоден із наведених варіантів"
      ],
      "key": 0
    },
    {
      "type": "choice",
      "prompt": "Обери значення слова cathedral.",
      "points": 1,
      "options": [
        "буклет",
        "собор",
        "екскурсовод",
        "Жоден із наведених варіантів"
      ],
      "key": 1
    },
    {
      "type": "choice",
      "prompt": "I need ___ ticket because mine is lost.",
      "points": 1,
      "options": [
        "others",
        "other",
        "another",
        "Жоден із наведених варіантів"
      ],
      "key": 2
    },
    {
      "type": "choice",
      "prompt": "Some attractions are better than ___.",
      "points": 1,
      "options": [
        "others",
        "another",
        "other one attraction",
        "Жоден із наведених варіантів"
      ],
      "key": 0
    },
    {
      "type": "choice",
      "prompt": "We can visit either the museum ___ the park.",
      "points": 1,
      "options": [
        "and nor",
        "or",
        "nor",
        "Жоден із наведених варіантів"
      ],
      "key": 1
    },
    {
      "type": "choice",
      "prompt": "Прочитай текст і визнач правильну відповідь.\n\nI can now talk about travel, landmarks and routes. I test myself without looking at the examples first. Then I compare my answers with the models and correct mistakes. I choose one speaking task and one written task to show what I can do. My next step is to practise the skill that still feels difficult.\n\nWhat do I do before checking the models?",
      "points": 2,
      "options": [
        "copy the answers",
        "skip all tasks",
        "test myself",
        "Жоден із наведених варіантів"
      ],
      "key": 2
    },
    {
      "type": "choice",
      "prompt": "Прочитай текст і визнач правильну відповідь.\n\nI can now talk about travel, landmarks and routes. I test myself without looking at the examples first. Then I compare my answers with the models and correct mistakes. I choose one speaking task and one written task to show what I can do. My next step is to practise the skill that still feels difficult.\n\nWhat do I practise next?",
      "points": 2,
      "options": [
        "the skill that feels difficult",
        "only my favourite word",
        "nothing",
        "Жоден із наведених варіантів"
      ],
      "key": 0
    }
  ],
  "id": "7-sb-u8-look-back-homework-01",
  "platforms": {
    "naurok": {
      "test_id": "3887244",
      "test_url": "https://naurok.com.ua/test-beta/test/3887244",
      "builder_url": "https://naurok.com.ua/test/builder/3887244",
      "status": "published_pending_homework_daily_limit",
      "verified": true,
      "deadline": "2027-06-01T23:00",
      "semester": 2,
      "points": 10,
      "question_points": [
        1,
        1,
        1,
        1,
        1,
        1,
        2,
        2
      ]
    },
    "kahoot": {
      "id": "5b6b7df7-170a-4e7c-9553-e8b2b176d3ac",
      "editor_url": "https://create.kahoot.it/creator/5b6b7df7-170a-4e7c-9553-e8b2b176d3ac",
      "test_url": "https://create.kahoot.it/details/7-107/5b6b7df7-170a-4e7c-9553-e8b2b176d3ac",
      "title": "7 клас · 107 · Подорожі: повторення",
      "status": "homework_created",
      "verified": true,
      "visibility": "private",
      "publication_pending_confirmation": true,
      "question_count": 8,
      "content_slide_count": 1,
      "kahoot_question_weights": [
        1,
        1,
        1,
        1,
        1,
        1,
        2,
        2
      ],
      "normalization_max": 10,
      "normalization_formula": "earned_points / maximum_possible_points * 10",
      "course_id": "9d134573-e692-403a-ae7d-3267fa4fb7f3",
      "course_title": "7 клас",
      "course_module": 8,
      "course_module_actual": 8,
      "course_membership_verified": true,
      "assignment_id": "9c4a8ca6-0d29-4b77-91bf-57348f7e765f",
      "code": "00699587",
      "student_url": "https://kahoot.it/challenge/00699587",
      "teacher_assignment_url": "https://create.kahoot.it/reports/new-challenge/9c4a8ca6-0d29-4b77-91bf-57348f7e765f/7232023c-aa35-4b97-9ba5-76aaead1c7a9/1793294137031/summary",
      "deadline": null,
      "no_deadline": true,
      "question_timer": false,
      "randomize_answer_order": true,
      "student_entry_verified": true,
      "assignment_verified": true,
      "content_verified_after_reopen": true,
      "assessment_lesson_path": "7/sb-u8-self-check/",
      "created_on": "2026-10-29",
      "updated_on": "2026-10-29"
    }
  },
  "assessment": {
    "deadline": "2027-06-01T23:00",
    "semester": 2,
    "timezone": "Europe/Kyiv"
  }
}
