{
  "schema_version": 1,
  "title": "7 клас · What is there to see and to do?: Лексика: застосування Подорожі й визначні місця · Лексика: застосування",
  "grade": 7,
  "purpose": "homework_check",
  "source_lesson": "7/sb-u8-vocabulary-2/index.html",
  "source_title": "What is there to see and to do?: Лексика: застосування Подорожі й визначні місця · Лексика: застосування",
  "assessment_lesson": "7/sb-u8-grammar-2/index.html",
  "placement": {
    "rule": "next_lesson",
    "note": "Перевірка домашнього завдання за попередньою темою на наступному уроці."
  },
  "total_points": 10,
  "questions": [
    {
      "type": "choice",
      "prompt": "Обери значення слова statue.",
      "points": 1,
      "options": [
        "статуя",
        "пам’ятник",
        "художня галерея",
        "Жоден із наведених варіантів"
      ],
      "key": 0
    },
    {
      "type": "choice",
      "prompt": "Обери значення слова bridge.",
      "points": 1,
      "options": [
        "архітектура",
        "міст",
        "художня галерея",
        "Жоден із наведених варіантів"
      ],
      "key": 1
    },
    {
      "type": "choice",
      "prompt": "Обери значення слова monument.",
      "points": 1,
      "options": [
        "архітектура",
        "турист",
        "пам’ятник",
        "Жоден із наведених варіантів"
      ],
      "key": 2
    },
    {
      "type": "choice",
      "prompt": "I need ___ ticket because mine is lost.",
      "points": 1,
      "options": [
        "another",
        "others",
        "other",
        "Жоден із наведених варіантів"
      ],
      "key": 0
    },
    {
      "type": "choice",
      "prompt": "Some attractions are better than ___.",
      "points": 1,
      "options": [
        "other one attraction",
        "others",
        "another",
        "Жоден із наведених варіантів"
      ],
      "key": 1
    },
    {
      "type": "choice",
      "prompt": "We can visit either the museum ___ the park.",
      "points": 1,
      "options": [
        "nor",
        "and nor",
        "or",
        "Жоден із наведених варіантів"
      ],
      "key": 2
    },
    {
      "type": "choice",
      "prompt": "Прочитай текст і визнач правильну відповідь.\n\nIn our next activity, we will choose useful words for travel, landmarks and routes. We will use these words in full sentences, compare our examples with a partner and explain our choices.\n\nHow will we use the words?",
      "points": 2,
      "options": [
        "in full sentences",
        "only as numbers",
        "without any context",
        "Жоден із наведених варіантів"
      ],
      "key": 0
    },
    {
      "type": "choice",
      "prompt": "Прочитай текст і визнач правильну відповідь.\n\nIn our next activity, we will choose useful words for travel, landmarks and routes. We will use these words in full sentences, compare our examples with a partner and explain our choices.\n\nWhat will we explain?",
      "points": 2,
      "options": [
        "nothing",
        "our choices",
        "a ticket price",
        "Жоден із наведених варіантів"
      ],
      "key": 1
    }
  ],
  "id": "7-sb-u8-vocabulary-2-homework-01",
  "platforms": {
    "naurok": {
      "test_id": "3887231",
      "test_url": "https://naurok.com.ua/test-beta/test/3887231",
      "status": "published_pending_homework_daily_limit",
      "verified": true,
      "deadline": "2027-06-01T23:00",
      "semester": 2,
      "points": 10,
      "question_points": [
        1,
        1,
        1,
        1,
        1,
        1,
        2,
        2
      ]
    },
    "kahoot": {
      "title": "7 клас · 102 · Подорожі: лексика",
      "kahoot_id": "bc7d2898-1ba1-444a-9d88-84fd8b8c7acf",
      "editor_url": "https://create.kahoot.it/creator/bc7d2898-1ba1-444a-9d88-84fd8b8c7acf",
      "test_url": "https://create.kahoot.it/details/7-102/bc7d2898-1ba1-444a-9d88-84fd8b8c7acf",
      "status": "homework_created",
      "verified": true,
      "visibility": "public",
      "question_count": 8,
      "content_slide_count": 2,
      "assignment_id": "82374f60-506c-49fc-933e-a7d4bb2f4e67",
      "code": "0054352693",
      "student_url": "https://kahoot.it/challenge/0054352693",
      "teacher_assignment_url": "https://create.kahoot.it/reports/new-challenge/82374f60-506c-49fc-933e-a7d4bb2f4e67/7232023c-aa35-4b97-9ba5-76aaead1c7a9/1793251950051/summary",
      "deadline": null,
      "no_deadline": true,
      "normalization_max": 10,
      "normalization_formula": "earned_points / maximum_possible_kahoot_score * 10",
      "question_weights": [
        1,
        1,
        1,
        1,
        1,
        1,
        2,
        2
      ],
      "course_id": "9d134573-e692-403a-ae7d-3267fa4fb7f3",
      "course_title": "7 клас",
      "course_module": 8,
      "course_membership_verified": true
    }
  },
  "assessment": {
    "deadline": "2027-06-01T23:00",
    "semester": 2,
    "timezone": "Europe/Kyiv"
  }
}
