{
  "schema_version": 1,
  "title": "7 клас · What’s the matter?: Граматика: застосування Самопочуття і спілкування з лікарем · Граматика: застосування",
  "grade": 7,
  "purpose": "homework_check",
  "source_lesson": "7/sb-u6-grammar-2/index.html",
  "source_title": "What’s the matter?: Граматика: застосування Самопочуття і спілкування з лікарем · Граматика: застосування",
  "assessment_lesson": "7/sb-u6-speaking/index.html",
  "placement": {
    "rule": "next_lesson",
    "note": "Перевірка домашнього завдання за попередньою темою на наступному уроці."
  },
  "total_points": 10,
  "questions": [
    {
      "type": "choice",
      "prompt": "Обери значення слова cough.",
      "points": 1,
      "options": [
        "запис на прийом",
        "кашель",
        "головний біль",
        "Жоден із наведених варіантів"
      ],
      "key": 1
    },
    {
      "type": "choice",
      "prompt": "Обери значення слова sore throat.",
      "points": 1,
      "options": [
        "запис на прийом",
        "симптом",
        "біль у горлі",
        "Жоден із наведених варіантів"
      ],
      "key": 2
    },
    {
      "type": "choice",
      "prompt": "Обери значення слова headache.",
      "points": 1,
      "options": [
        "головний біль",
        "симптом",
        "медсестра; медбрат",
        "Жоден із наведених варіантів"
      ],
      "key": 0
    },
    {
      "type": "choice",
      "prompt": "He ___ sent a message before the lesson started.",
      "points": 1,
      "options": [
        "have",
        "had",
        "has",
        "Жоден із наведених варіантів"
      ],
      "key": 1
    },
    {
      "type": "choice",
      "prompt": "Had you ___ the homework before the call?",
      "points": 1,
      "options": [
        "finish",
        "finishing",
        "finished",
        "Жоден із наведених варіантів"
      ],
      "key": 2
    },
    {
      "type": "choice",
      "prompt": "What ___ you done before three o’clock?",
      "points": 1,
      "options": [
        "had",
        "have",
        "did had",
        "Жоден із наведених варіантів"
      ],
      "key": 0
    },
    {
      "type": "choice",
      "prompt": "Прочитай текст і визнач правильну відповідь.\n\nAlex missed school on Tuesday. He had sent a message to his teacher before the lesson started. Later his friend called and asked how he felt. Alex said that he had a headache and wanted to rest. On Friday he returned to school and collected the notes. If he misses a lesson, he asks a classmate what the class studied.\n\nWhat had Alex done before the lesson?",
      "points": 2,
      "options": [
        "played football",
        "sent a message",
        "watched a film",
        "Жоден із наведених варіантів"
      ],
      "key": 1
    },
    {
      "type": "choice",
      "prompt": "Прочитай текст і визнач правильну відповідь.\n\nAlex missed school on Tuesday. He had sent a message to his teacher before the lesson started. Later his friend called and asked how he felt. Alex said that he had a headache and wanted to rest. On Friday he returned to school and collected the notes. If he misses a lesson, he asks a classmate what the class studied.\n\nWhen did Alex return to school?",
      "points": 2,
      "options": [
        "on Tuesday",
        "on Sunday",
        "on Friday",
        "Жоден із наведених варіантів"
      ],
      "key": 2
    }
  ],
  "id": "7-sb-u6-grammar-2-homework-01",
  "platforms": {
    "naurok": {
      "test_id": "3887201",
      "test_url": "https://naurok.com.ua/test-beta/test/3887201",
      "builder_url": "https://naurok.com.ua/test/builder/3887201",
      "status": "published_pending_homework_daily_limit",
      "verified": true,
      "deadline": "2027-06-01T23:00",
      "semester": 2,
      "points": 10,
      "question_points": [
        1,
        1,
        1,
        1,
        1,
        1,
        2,
        2
      ]
    }
  },
  "assessment": {
    "deadline": "2027-06-01T23:00",
    "semester": 2,
    "timezone": "Europe/Kyiv"
  }
}
