{
  "schema_version": 1,
  "title": "9 клас · All About Me: Письмо",
  "grade": 9,
  "purpose": "homework_check",
  "source_lesson": "9/sb-u1-writing/index.html",
  "source_title": "All About Me: Письмо Усе про мене: Письмо",
  "assessment_lesson": "9/sb-u1-look-back/index.html",
  "placement": {
    "rule": "next_lesson",
    "note": "Перевірка домашнього завдання за попередньою темою на наступному уроці."
  },
  "total_points": 10,
  "questions": [
    {
      "type": "choice",
      "prompt": "Обери значення слова personality.",
      "points": 1,
      "options": [
        "допитливий",
        "приклад для наслідування",
        "особистість"
      ],
      "key": 2
    },
    {
      "type": "choice",
      "prompt": "Обери значення слова confident.",
      "points": 1,
      "options": [
        "саморозвиток",
        "упевнений",
        "приклад для наслідування"
      ],
      "key": 1
    },
    {
      "type": "choice",
      "prompt": "Обери значення слова curious.",
      "points": 1,
      "options": [
        "допитливий",
        "саморозвиток",
        "ім’я"
      ],
      "key": 0
    },
    {
      "type": "choice",
      "prompt": "At seven yesterday, I ... my profile.",
      "points": 2,
      "options": [
        "am writing",
        "was writing",
        "write"
      ],
      "key": 1
    },
    {
      "type": "choice",
      "prompt": "When we arrived, the interview ... already ... .",
      "points": 2,
      "options": [
        "had / started",
        "has / started",
        "is / starting"
      ],
      "key": 0
    },
    {
      "type": "choice",
      "prompt": "Прочитай текст. Emma is preparing a short autobiography. She describes where she grew up and how she became interested in photography. She is taking part in a school exhibition next Friday. She has already chosen the photos, so this is an arrangement. She thinks she will learn a lot from the visitors and is going to ask them for feedback.\n\nWhy will she ask for feedback?",
      "points": 3,
      "options": [
        "to change her name",
        "to learn from the visitors",
        "to cancel the exhibition"
      ],
      "key": 1
    }
  ],
  "id": "9-sb-u1-writing-homework-01",
  "platforms": {
    "naurok": {
      "test_id": "3886881",
      "test_url": "https://naurok.com.ua/test/9-klas-all-about-me-pismo-3886881.html",
      "status": "homework_created",
      "verified": true,
      "homework_id": "86437152",
      "teacher_homework_url": "https://naurok.com.ua/test-beta/homework/86437152",
      "student_url": "https://naurok.ua/test/join?gamecode=3421266",
      "code": "3421266",
      "deadline": "2027-01-03T23:00",
      "semester": 1,
      "points": 10,
      "question_points": [
        1,
        1,
        1,
        2,
        2,
        3
      ]
    }
  },
  "assessment": {
    "deadline": "2027-01-03T23:00",
    "semester": 1,
    "timezone": "Europe/Kyiv"
  }
}
