{
  "schema_version": 1,
  "title": "Superstar · 6 клас · ESL song-4",
  "grade": 6,
  "purpose": "homework_check",
  "source_lesson": "6/sb-song-4/index.html",
  "source_title": "Superstar Пісня: мрії про успіх",
  "assessment_lesson": "6/sb-round-up-8/index.html",
  "placement": {
    "rule": "next_lesson",
    "note": "Перевірка домашнього завдання за попередньою темою на наступному уроці."
  },
  "total_points": 10,
  "questions": [
    {
      "type": "word",
      "prompt": "Напиши англійською: «альбом».",
      "points": 1,
      "answers": [
        "album"
      ]
    },
    {
      "type": "word",
      "prompt": "Напиши англійською: «запис».",
      "points": 1,
      "answers": [
        "record"
      ]
    },
    {
      "type": "word",
      "prompt": "Напиши англійською: «угода».",
      "points": 1,
      "answers": [
        "deal"
      ]
    },
    {
      "type": "choice",
      "prompt": "Yesterday the singer ___ an award.",
      "points": 1,
      "options": [
        "wins",
        "winning",
        "won"
      ],
      "key": 2
    },
    {
      "type": "choice",
      "prompt": "The singer is going to ___ on tour.",
      "points": 1,
      "options": [
        "going",
        "go",
        "went"
      ],
      "key": 1
    },
    {
      "type": "choice",
      "prompt": "People who support a singer are ___.",
      "points": 1,
      "options": [
        "fans",
        "editors",
        "printers"
      ],
      "key": 0
    },
    {
      "type": "choice",
      "prompt": "Прочитай текст: The song presents a singer who has become successful. The singer describes a record deal, albums, fans and an award. There is also a plan to go on tour. The cheerful voice of the song shows pride and excitement. Students can discuss whether fame, money or enjoying the work matters most to them.\n\nWhat future plan is mentioned?",
      "points": 2,
      "options": [
        "Buying a library.",
        "Leaving music.",
        "Going on tour."
      ],
      "key": 2
    },
    {
      "type": "choice",
      "prompt": "Прочитай текст: The song presents a singer who has become successful. The singer describes a record deal, albums, fans and an award. There is also a plan to go on tour. The cheerful voice of the song shows pride and excitement. Students can discuss whether fame, money or enjoying the work matters most to them.\n\nWhich feelings does the song show?",
      "points": 2,
      "options": [
        "Confusion and anger.",
        "Pride and excitement.",
        "Fear and sadness."
      ],
      "key": 1
    }
  ],
  "id": "6-sb-song-4-homework-01",
  "platforms": {
    "naurok": {
      "test_id": "3887114",
      "test_url": "https://naurok.com.ua/test-beta/test/3887114",
      "builder_url": "https://naurok.com.ua/test/builder/3887114",
      "status": "published_pending_homework_daily_limit",
      "verified": true,
      "deadline": "2027-06-01T23:00",
      "semester": 2,
      "points": 10,
      "question_points": [
        1,
        1,
        1,
        1,
        1,
        1,
        2,
        2
      ]
    },
    "kahoot": {
      "id": "d735e02e-730f-4d36-9e78-97b47edad639",
      "editor_url": "https://create.kahoot.it/creator/d735e02e-730f-4d36-9e78-97b47edad639",
      "status": "homework_created",
      "verified": true,
      "visibility": "public",
      "question_count": 8,
      "content_slide_count": 2,
      "kahoot_question_weights": [
        1,
        1,
        1,
        1,
        1,
        1,
        2,
        2
      ],
      "normalization_max": 10,
      "normalization_formula": "earned_points / maximum_possible_points * 10",
      "assignment_id": "873f25fb-170f-4678-b0ea-0732958c8ac3",
      "code": "001963163",
      "student_url": "https://kahoot.it/challenge/001963163",
      "teacher_assignment_url": "https://create.kahoot.it/reports/new-challenge/873f25fb-170f-4678-b0ea-0732958c8ac3/7232023c-aa35-4b97-9ba5-76aaead1c7a9/1793051992416/summary",
      "deadline": null,
      "no_deadline": true,
      "question_timer": false,
      "randomize_answer_order": true,
      "student_entry_verified": true,
      "content_verified_after_reopen": true,
      "adaptations": [
        "Прості питання 1–6 мають стандартні бали, складніші питання 7–8 — подвійні; 10 сирих балів переводяться до шкали 10."
      ],
      "course_id": "7572952c-010e-4290-8d43-1a907efd66cc",
      "course_title": "6 клас",
      "course_module": 8
    }
  },
  "assessment": {
    "deadline": "2027-06-01T23:00",
    "semester": 2,
    "timezone": "Europe/Kyiv"
  }
}
