{
  "schema_version": 1,
  "title": "6 клас · Jolly Phonics · Group 7",
  "grade": 6,
  "purpose": "homework_check",
  "source_lesson": "6/jolly-phonics/index.html",
  "source_title": "sun",
  "assessment_lesson": "6/jolly-phonics/index.html",
  "placement": {
    "rule": "no_next_lesson",
    "note": "Перевірка після теми: окремого наступного уроку в навігації немає; збережено в папці вихідної теми."
  },
  "total_points": 10,
  "questions": [
    {
      "type": "word",
      "prompt": "Jolly Phonics. Який запис літери або буквосполучення на картці зі словом queen позначає звук /kw/? Напишіть запис із картки; збережіть риску між літерами, якщо вона є на картці.",
      "points": 1,
      "answers": [
        "qu"
      ]
    },
    {
      "type": "word",
      "prompt": "Jolly Phonics. Який запис літери або буквосполучення на картці зі словом cloud позначає звук /aʊ/? Напишіть запис із картки; збережіть риску між літерами, якщо вона є на картці.",
      "points": 1,
      "answers": [
        "ou"
      ]
    },
    {
      "type": "word",
      "prompt": "Jolly Phonics. Який запис літери або буквосполучення на картці зі словом coin позначає звук /ɔɪ/? Напишіть запис із картки; збережіть риску між літерами, якщо вона є на картці.",
      "points": 1,
      "answers": [
        "oi"
      ]
    },
    {
      "type": "word",
      "prompt": "Відновіть слово з картки Jolly Phonics: gl___. Напишіть повне англійське слово.",
      "points": 2,
      "answers": [
        "glue"
      ]
    },
    {
      "type": "word",
      "prompt": "Відновіть слово з картки Jolly Phonics: p___son. Напишіть повне англійське слово.",
      "points": 2,
      "answers": [
        "person"
      ]
    },
    {
      "type": "word",
      "prompt": "Складіть слово з картки Jolly Phonics із літер: r / a / c. Напишіть повне слово.",
      "points": 3,
      "answers": [
        "car"
      ]
    }
  ],
  "id": "6-jolly-phonics-homework-07",
  "platforms": {
    "naurok": {
      "test_id": "3886910",
      "test_url": "https://naurok.com.ua/test-beta/test/3886910",
      "builder_url": "https://naurok.com.ua/test/builder/3886910",
      "status": "published_pending_homework_daily_limit",
      "verified": true,
      "deadline": "2027-01-03T23:00",
      "semester": 1,
      "points": 10,
      "question_points": [
        1,
        1,
        1,
        2,
        2,
        3
      ]
    }
  },
  "assessment": {
    "deadline": "2027-01-03T23:00",
    "semester": 1,
    "timezone": "Europe/Kyiv"
  }
}
