{
  "schema_version": 1,
  "title": "7 клас · Are you ready to cook?: Блог і обговорення Приготування їжі · Блог і обговорення",
  "grade": 7,
  "purpose": "homework_check",
  "source_lesson": "7/sb-u3-blog/index.html",
  "source_title": "Are you ready to cook?: Блог і обговорення Приготування їжі · Блог і обговорення",
  "assessment_lesson": "7/sb-u3-vocabulary/index.html",
  "placement": {
    "rule": "next_lesson",
    "note": "Перевірка домашнього завдання за попередньою темою на наступному уроці."
  },
  "total_points": 10,
  "questions": [
    {
      "type": "choice",
      "prompt": "Обери значення слова chopping board.",
      "points": 1,
      "options": [
        "сковорода",
        "обробна дошка",
        "ополоник",
        "Жоден із наведених варіантів"
      ],
      "key": 1
    },
    {
      "type": "choice",
      "prompt": "Обери значення слова grater.",
      "points": 1,
      "options": [
        "сковорода",
        "помішувати",
        "тертка",
        "Жоден із наведених варіантів"
      ],
      "key": 2
    },
    {
      "type": "choice",
      "prompt": "Обери значення слова ladle.",
      "points": 1,
      "options": [
        "ополоник",
        "помішувати",
        "варити; кип’ятити",
        "Жоден із наведених варіантів"
      ],
      "key": 0
    },
    {
      "type": "choice",
      "prompt": "Eva ___ washed the tomatoes.",
      "points": 1,
      "options": [
        "is",
        "has",
        "have",
        "Жоден із наведених варіантів"
      ],
      "key": 1
    },
    {
      "type": "choice",
      "prompt": "Have you ___ the vegetables?",
      "points": 1,
      "options": [
        "chop",
        "chopping",
        "chopped",
        "Жоден із наведених варіантів"
      ],
      "key": 2
    },
    {
      "type": "choice",
      "prompt": "What ___ you prepared?",
      "points": 1,
      "options": [
        "have",
        "did have",
        "has",
        "Жоден із наведених варіантів"
      ],
      "key": 0
    },
    {
      "type": "choice",
      "prompt": "Прочитай текст і визнач правильну відповідь.\n\nWe have prepared a simple vegetable salad for our class picnic. Eva has washed the tomatoes and I have sliced the cucumbers on a chopping board. We have not added the dressing yet. Our recipe lists the ingredients first and then explains each step. We serve the salad politely and thank everyone who helped.\n\nWhat have the pupils prepared?",
      "points": 2,
      "options": [
        "fish soup",
        "a vegetable salad",
        "a chocolate cake",
        "Жоден із наведених варіантів"
      ],
      "key": 1
    },
    {
      "type": "choice",
      "prompt": "Прочитай текст і визнач правильну відповідь.\n\nWe have prepared a simple vegetable salad for our class picnic. Eva has washed the tomatoes and I have sliced the cucumbers on a chopping board. We have not added the dressing yet. Our recipe lists the ingredients first and then explains each step. We serve the salad politely and thank everyone who helped.\n\nWhat have they not added yet?",
      "points": 2,
      "options": [
        "the tomatoes",
        "the cucumbers",
        "the dressing",
        "Жоден із наведених варіантів"
      ],
      "key": 2
    }
  ],
  "id": "7-sb-u3-blog-homework-01",
  "platforms": {
    "naurok": {
      "test_id": "3886966",
      "test_url": "https://naurok.com.ua/test-beta/test/3886966",
      "status": "homework_created",
      "verified": true,
      "homework_id": "86400940",
      "teacher_homework_url": "https://naurok.com.ua/test-beta/homework/86400940",
      "student_url": "https://naurok.ua/test/join?gamecode=3719548",
      "code": "3719548",
      "deadline": "2027-01-03T23:00",
      "semester": 1,
      "points": 10,
      "question_points": [
        1,
        1,
        1,
        1,
        1,
        1,
        2,
        2
      ]
    },
    "kahoot": {
      "id": "5323a52f-8d1d-402d-a951-01b5fcfe26ad",
      "kahoot_id": "5323a52f-8d1d-402d-a951-01b5fcfe26ad",
      "editor_url": "https://create.kahoot.it/creator/5323a52f-8d1d-402d-a951-01b5fcfe26ad",
      "status": "homework_created",
      "verified": true,
      "visibility": "private",
      "question_count": 8,
      "quiz_question_count": 8,
      "content_slide_count": 2,
      "kahoot_question_weights": [
        1,
        1,
        1,
        1,
        1,
        1,
        2,
        2
      ],
      "maximum_scoring_units": 10,
      "normalization_max": 10,
      "normalization_formula": "earned_points / maximum_possible_kahoot_score * 10",
      "assignment_id": "b0f2c28e-94ac-4981-8e50-f45bfce3b523",
      "teacher_assignment_url": "https://create.kahoot.it/reports/new-challenge/b0f2c28e-94ac-4981-8e50-f45bfce3b523/7232023c-aa35-4b97-9ba5-76aaead1c7a9/1793100164418/summary",
      "code": "002833882",
      "student_url": "https://kahoot.it/challenge/002833882",
      "deadline": null,
      "no_deadline": true,
      "assignment_verified": true,
      "content_verified_after_reopen": true,
      "scoring_ui_verified": true,
      "assessment_lesson_path": "7/sb-u3-vocabulary/"
    }
  },
  "assessment": {
    "deadline": "2027-01-03T23:00",
    "semester": 1,
    "timezone": "Europe/Kyiv"
  }
}
